<!DOCTYPE dataset SYSTEM "src/test/resources/schema.dtd">
<dataset>
    <author id="1" name="AUTHOR1" photo="asd" avatar="avatar/asd.jpg" introduction="nothing"></author>
    <author id="2" name="AUTHOR2" photo="asd" avatar="asd" introduction="nothing"></author>
    <url id="1" url="http://szabi.hu"></url>
    <url id="2" url="http://show1.com"></url>
    <author_url author_id="1" url_id="1"></author_url>

    <textcontent id="1" title="tamogatas" type="page" format="legacy" content="asd" author="asd" alias="asd"
                 created="2012-12-12 12:12:12" modified="2012-12-12 12:12:12"></textcontent>

    <textcontent id="2" title="Jo musor" type="episode" format="legacy" content="fasza am" author="asd" alias="asd"
                 created="2012-12-12 12:12:12" modified="2012-12-12 12:12:12"></textcontent>

    <radioshow id="1" name="3. utas" alias="3utas" description="a potyoutasok műsora" type="0" status="1"></radioshow>
    <radioshow id="2" name="Haza és Haladás" alias="hazaeshaladas" description="h%h" type="0" status="1"></radioshow>
    <radioshow id="3" name="Vendéglő a világ végén" alias="vendeglo" description="mindenkiboldog" type="0"
               status="1"></radioshow>
    <show_url radioshow_id="1" url_id="2"></show_url>

    <contribution id="1" nick="bela" author_id="1" radioshow_id="1"></contribution>
    <contribution id="2" nick="bela" author_id="2" radioshow_id="1"></contribution>

    <episode id="2"
             radioshow_id="1"
             textcontent_id="2"
             plannedFrom="2014-04-11 08:00:00"
             plannedTo="2014-04-11 10:00:00"
             realFrom="2014-04-11 08:00:00"
             realTo="2014-04-11 10:00:00"
            ></episode>

    <episode id="1" radioshow_id="1" plannedFrom="2014-04-04 08:00:00" plannedTo="2014-04-04 10:00:00"
             realTo="2014-04-04 10:00:00" realFrom="2014-04-04 08:00:00"></episode>



    <scheduling id="1" validFrom="2014-04-15 10:00:00" validTo="2014-06-10 10:00:00" hourFrom="8" minFrom="0"
                duration="120"
                weekType="1" base="2014-04-15 10:00:00" weekDay="5" radioshow_id="1"></scheduling>

    <scheduling id="2" validFrom="2014-04-15 10:00:00" validTo="2014-06-10 10:00:00" hourFrom="8" minFrom="0"
                duration="120"
                weekType="2"
                base="2014-04-15 10:00:00"
                weekDay="5"
                radioshow_id="3"></scheduling>

    <bookmark id="1" start="2014-04-04 08:13:00" end="2014-04-04 10:13:00"
              title="Jo kis beszelgetes 1" content="x1" episode_id="1" selected="1" full_episode="0"
              karma="0"></bookmark>
    <bookmark id="2" start="2014-04-04 08:13:00" end="2014-04-04 10:13:00"
              title="Jo kis beszelgetes 2" content="x2" episode_id="1" radioshow_id="1" selected="0" full_episode="0"
              karma="0"></bookmark>

    <mix id="1" type="1" author="asd" title="good mix" file="asd.mp3" date="2013-04-05" show_id="1" category="2"></mix>
    <mix id="3" type="1" author="asd" title="good mix2" file="asd2.mp3" date="2013-04-05" show_id="1"
         category="1"></mix>
    <mix id="2" type="1" author="asd" title="good mix2" file="asd2.mp3" category="1"></mix>
    <tag id="1" name="kukac" type="0"></tag>
    <tag id="2" name="asd" type="0"></tag>
    <tag id="3" name="harom" type="0"></tag>
    <tag_textcontent textcontent_id="1" tag_id="1"></tag_textcontent>
    <tag_textcontent textcontent_id="2" tag_id="1"></tag_textcontent>
    <tag_textcontent textcontent_id="2" tag_id="3"></tag_textcontent>
    <tag_textcontent textcontent_id="1" tag_id="2"></tag_textcontent>



    <role id="3" name="author"></role>
    <user id="1" role_id="3" username="bela" email="bela@bela.hu" password="22679322a29a62da3c2558eac2ec5fe3d055db61"
          salt="d25541250d47c49f20b5243f95dbbd91e4db3d0d"></user>

    <change_password id="1" token="sadasd" created="2009-12-12 12:23:00" user_id="1"></change_password>


    <comment id="1" comment="mi ez a fos zene" type="0" identifier="1" status="1" author_id="1"></comment>
    <comment id="2" comment="mi ez a fos zene2" type="0" identifier="1" status="1" author_id="1"></comment>
    <comment id="3" comment="mi ez a fos zene3" parent_id="2" type="0" identifier="1" status="0" author_id="1"></comment>

</dataset>
